{
  "$schema": "https://schemas.neuralstock.ai/v0.2/registry.schema.json",
  "schema_version": "0.2",
  "document_type": "registry",
  "generated": true,
  "revision": "6c7e5755db87c08ffd03709920176eebb539a835fe683caf5b093f1e57550661",
  "generated_at": "2026-08-01T00:00:00Z",
  "profiles": ["web-v1"],
  "entries": [],
  "aliases": [],
  "withdrawals": []
}
